{
  "schemaVersion": "1.0.0",
  "release": "v1",
  "network": "testnet",
  "networkPassphrase": "Test SDF Network ; September 2015",
  "rpcUrl": "https://soroban-testnet.stellar.org",
  "horizonUrl": "https://horizon-testnet.stellar.org",
  "deploymentLedger": 3101238,
  "deployedAt": "2026-06-15T10:22:51.652Z",
  "deployer": "GCMPINZMMQVQ7MWIJLB34F5JRAHLQQTWCP6XB5HEZR353PPPWRUWHLPU",
  "admin": "GCMPINZMMQVQ7MWIJLB34F5JRAHLQQTWCP6XB5HEZR353PPPWRUWHLPU",
  "multisig": null,
  "wiring": {
    "reputationVerifier": {
      "admin": "GCMPINZMMQVQ7MWIJLB34F5JRAHLQQTWCP6XB5HEZR353PPPWRUWHLPU",
      "groth16Verifier": "CAWXRGFZITZ7TJIZNDLOPJNVEMPAZDWFI22XI76FC67YF2MDRUXLBS2T"
    },
    "attestationEngineV2": {
      "admin": "GCMPINZMMQVQ7MWIJLB34F5JRAHLQQTWCP6XB5HEZR353PPPWRUWHLPU",
      "governance": "GCMPINZMMQVQ7MWIJLB34F5JRAHLQQTWCP6XB5HEZR353PPPWRUWHLPU",
      "schemaRegistry": "CA5XA2T2DAOZH7QG5RG2372KGDHMCEVQJMBGT7AJMNHRI6C4ZIM37QCP",
      "version": 1
    },
    "privacyPool": {
      "admin": "GCMPINZMMQVQ7MWIJLB34F5JRAHLQQTWCP6XB5HEZR353PPPWRUWHLPU",
      "groth16Verifier": "CD2SQALXCZDRTWMFGUBRIP2GFH6TJ3GQ3S6YU4R4C2IIEYC43MLUMS7Q",
      "nativeSac": "CDLZFC3SYJYDZT7K67VZ75HPJVIEUVNIXF47ZG2FB2RMQQVU2HHGCYSC",
      "scope": 1
    }
  },
  "deploymentStatus": "deployed",
  "contracts": {
    "stealthRegistry": {
      "id": "CAIXWMGYZR3YAQ3CPCXOU42WG62E3ARUSG4GDHHDMNRXUD44YSGE5VXW",
      "wasmHash": "6612415551b2ab107afb6732681e1937da1efab18b4db0a7be94bc5bde452a90",
      "package": "stealth-registry"
    },
    "stealthAnnouncer": {
      "id": "CB2Y3GJMPY5BUSZLXG3DSIMERCNCTUM63IIEQ2GUNYEJ3DBKPFIZQGCS",
      "wasmHash": "c7d936a42d8aeba0642b5fba002ad3af828d662647531df3436d3a8c4ab71a9b",
      "package": "stealth-announcer"
    },
    "groth16Verifier": {
      "id": "CAWXRGFZITZ7TJIZNDLOPJNVEMPAZDWFI22XI76FC67YF2MDRUXLBS2T",
      "wasmHash": "ec350ff42b208e4b00f8f0ec5ed7ce7704a78987021b1538bfab3f3a8a59cbb1",
      "package": "groth16-verifier"
    },
    "reputationVerifier": {
      "id": "CBHDKX5YVBLFVZUMCM2355Q3R7EM6SIQYMO7PN7TB46QAIT5SDTQZENA",
      "wasmHash": "78e74e5b7ec8a7e7c8b4da9bb26dfbdba9d1b8e511a10930f3a7c4500807ced9",
      "package": "reputation-verifier"
    },
    "schemaRegistry": {
      "id": "CA5XA2T2DAOZH7QG5RG2372KGDHMCEVQJMBGT7AJMNHRI6C4ZIM37QCP",
      "wasmHash": "154dcfe43e72e8a8147a66f3e589883fca6e29e9dd086d22e122a9c1228b45e3",
      "package": "schema-registry"
    },
    "attestationEngineV2": {
      "id": "CB6KOWOQBFQDX5NNGUJGECHXUF3LHUE77FYD2C6JSWMHYWGCJOUTSDPX",
      "wasmHash": "abd9e5285d8982670fcefd1c1b6458b623b9d6bed24b39887670a7f014b23520",
      "package": "attestation-engine-v2"
    },
    "poolVerifier": {
      "id": "CD2SQALXCZDRTWMFGUBRIP2GFH6TJ3GQ3S6YU4R4C2IIEYC43MLUMS7Q",
      "wasmHash": "bf1c8d1d2cccf6eba4e531aaf2ea259a69323663a787c2f4d561204e84c07d36",
      "package": "groth16-verifier"
    },
    "privacyPool": {
      "id": "CAYXZTWB26VPIO6UTKFM22UY6XIMO72IRCFKAU2C6NSMQ4JSJ6VJ7BLE",
      "wasmHash": "be56375a242860d67143d19536c5404f7ddf29537ec16e7bfef4b624a21322db",
      "package": "privacy-pool"
    }
  },
  "artifacts": {
    "frontend": {
      "buildCommit": null,
      "repository": "https://github.com/opaquecash/stellar"
    },
    "circuits": {
      "v2": {
        "r1csHash": "c67a500de9f45d87e59eac1b239d76768866c5dc0a1e6bee5adaf258d09c0504",
        "verificationKeyHash": "e79286559a6a9c5c7ceb613909d51fa4344c391fa407ed1d700b74c41867986f",
        "witnessWasmHash": "238c5a0f34f164d8ac08420a5484c5c7917aaba2ba86bb26ad63206be8364880",
        "zkeyHash": "6bbee378c05c2d4f1dfc118fb15e2c7b4bacf78e2518881c576d81da5894442d",
        "contractVkHash": "90576843d1c969d1244782087b6f8005cb94ca25f46d0e4b20e1b1abd63d4c95",
        "zkeyHashBinding": "6bbee378c05c2d4f1dfc118fb15e2c7b4bacf78e2518881c576d81da5894442d"
      },
      "v1": {
        "witnessWasmHash": "48308a1097217d50bebe859d1cdab52da51dcc8ba2aa959eb7198f9a734d8913",
        "zkeyHash": "4fc1d57377b43435853a70dcca374dc9f878e49a410adf53b479ed5edee78a42",
        "r1csHash": "78bbd68d36438fc90008366200a36963e81af1c399bca46a2dd55759aac628ba",
        "verificationKeyHash": "092573ee3ee637d4a0ccf337cb67109ee7ec4536d19668921b8018667940bf4d",
        "contractVkHash": "db96564b4e1668bbd8455f4d0f4ecb5544b8358e19449380e44307b78b70b4d7",
        "zkeyHashBinding": "4fc1d57377b43435853a70dcca374dc9f878e49a410adf53b479ed5edee78a42"
      }
    },
    "scanner": {
      "wasmHash": "31840c413d0440937c5e56ecbb4cb8695bbc4c198d6418c26e99a3dda2a44620"
    }
  },
  "verification": {
    "command": "stellar contract build && node scripts/verify-deployment-manifest.mjs --network testnet --check-wasm",
    "output": null
  }
}
